{
  "entityType": "plan",
  "documentKind": "product-requirements",
  "artifactStrategy": {
    "sourceOfTruth": "json-payload",
    "renderedViews": [
      "markdown"
    ],
    "preservation": "Store this content JSON sidecar next to the rendered Markdown PRD and treat the JSON as canonical for automation."
  },
  "contextGrounding": {
    "codebaseContext": "Doc-Vader currently has backlog validation, work-item mutation, record creation, PRD validation/rendering, and a library-level AFK eligibility helper. It does not yet expose the Sandcastle-facing `dv task` command surface needed for deterministic dogfooding. The architecture now treats Doc-Vader as an entity-governance runtime: Work Item is canonical, Task is the Sandcastle command projection, and the local MVP runtime authority is Git-managed durable files plus SQLite-backed claims, locks, and execution logs.",
    "domainVocabulary": [
      "Sandcastle",
      "dogfood loop",
      "dv task ready",
      "dv task show",
      "dv task prompt",
      "dv task claim",
      "dv claim complete",
      "dv task record --claim",
      "authoritative task JSON",
      "templjs render",
      "SQLite runtime authority",
      "claim-owned file locks",
      "AFK-ready",
      "HITL",
      "fail-closed",
      "claim-aware evidence",
      "storage adapter",
      "format adapter"
    ],
    "adrAlignment": "This PRD is governed by the entity-governance ADR set: adr-005, adr-006, adr-007, adr-008, and adr-009. It narrows Sandcastle dogfooding to a safe local runtime MVP and defers hosted authority, full Work Graph or Decision Graph engines, immutable scope graphs, and nested artifact reservations.",
    "sourceContext": [
      "Conversation decision: Sandcastle dogfooding should use the Git plus SQLite local multi-agent runtime path rather than the prior single-agent claim-lock or scope-graph-first plan.",
      "Conversation decision: `dv task prompt` renders a templjs prompt from the same authoritative task JSON used by `dv task show --json`.",
      "Conversation decision: `dv task record --claim` is part of the minimum path and should use `--payload` JSON as the primary MVP interface, including stdin support.",
      "Current CLI surface in `cli/doc-vader.ts` exposes backlog, work-item, record, and prd domains, but not a task domain.",
      "Current helper in `lib/backlog/backlog.ts` filters AFK-ready candidates by active ready work-item status and tags, but does not expose command-level runtime gates or claim awareness.",
      "Existing backlog records 60341 through 60346 describe the fuller Sandcastle command surface."
    ]
  },
  "problemStatement": "The maintainer wants to use Sandcastle to improve Doc-Vader itself, but the current command surface is not yet deterministic enough for safe agent selection and workflow. Without a minimal `dv task` surface, Sandcastle would need inline scripts or manual file edits for selection, claiming, task context, and evidence linking, which would bypass repository guardrails and make dogfooding unsafe.",
  "solution": "Deliver a Sandcastle dogfood MVP over the entity-governance runtime: deterministic AFK-ready selection, SQLite-backed claim creation, claim-owned file locks, task show/prompt rendering from canonical task JSON, claim-aware record creation through schema-validated payloads, and claim completion that preserves validation and evidence gates. This enables local Sandcastle agents to select, claim, inspect, implement, validate, record evidence, and complete runtime execution without needing hosted authority, a full Work Graph engine, or immutable scope graphs.",
  "coverageModel": {
    "actors": [
      "repository maintainer",
      "Sandcastle planner",
      "implementation agent",
      "review or merge agent"
    ],
    "journeyStages": [
      "ready selection",
      "claim acquisition",
      "task context rendering",
      "implementation execution",
      "evidence recording",
      "handoff and completion"
    ],
    "concerns": [
      "deterministic selection",
      "fail-closed safety",
      "no hand-edited backlog state",
      "template determinism",
      "parallelizable implementation",
      "minimal scope"
    ],
    "notes": "The coverage model targets safe local dogfooding on the Git plus SQLite runtime adapter, not hosted production coordination."
  },
  "userStories": [
    {
      "story": "As a Sandcastle planner, I want `dv task ready --json` to return only AFK-ready work with structured exclusion reasons, so that Sandcastle never starts HITL, invalid, dependency-blocked, or already claimed work.",
      "covers": {
        "actor": "Sandcastle planner",
        "journeyStage": "ready selection",
        "concern": "deterministic selection"
      }
    },
    {
      "story": "As a repository maintainer, I want claim creation and file locks before Sandcastle edits files, so that dogfooding prevents duplicate local agents from selecting or mutating conflicting task work without waiting for hosted claim authority.",
      "covers": {
        "actor": "repository maintainer",
        "journeyStage": "claim acquisition",
        "concern": "fail-closed safety"
      }
    },
    {
      "story": "As an implementation agent, I want `dv task show --json` and `dv task prompt` to use the same authoritative task JSON, so that machine selection and human-readable execution context cannot drift.",
      "covers": {
        "actor": "implementation agent",
        "journeyStage": "task context rendering",
        "concern": "template determinism"
      }
    },
    {
      "story": "As an implementation agent, I want `dv task record --claim --payload` to create and link evidence through one validated command, so that Sandcastle does not hand-edit backlog or record files.",
      "covers": {
        "actor": "implementation agent",
        "journeyStage": "evidence recording",
        "concern": "no hand-edited backlog state"
      }
    },
    {
      "story": "As a review or merge agent, I want the dogfood flow to stop before close unless validation and evidence are recorded, so that early Sandcastle use cannot bypass existing close/finalize gates.",
      "covers": {
        "actor": "review or merge agent",
        "journeyStage": "handoff and completion",
        "concern": "minimal scope"
      }
    },
    {
      "story": "As a repository maintainer, I want the dogfood MVP decomposed into parallelizable vertical slices, so that agents can converge on a safe Sandcastle integration point efficiently.",
      "covers": {
        "actor": "repository maintainer",
        "journeyStage": "implementation execution",
        "concern": "parallelizable implementation"
      }
    }
  ],
  "coverageReview": {
    "status": "complete",
    "notes": "Stories cover selection, claim, context rendering, evidence recording, handoff, and implementation parallelization for the safe local dogfood path.",
    "gaps": []
  },
  "qualityReview": {
    "dimensions": [
      {
        "name": "grounding",
        "score": 5,
        "rationale": "The PRD is grounded in the current CLI/library surface, active Sandcastle backlog items, and explicit conversation decisions."
      },
      {
        "name": "coverage",
        "score": 5,
        "rationale": "The coverage model targets every stage needed for safe local dogfooding while naming excluded production concerns."
      },
      {
        "name": "decision-rationale",
        "score": 5,
        "rationale": "Each durable decision explains why the MVP favors simple local safety over the full coordination architecture."
      },
      {
        "name": "testability",
        "score": 5,
        "rationale": "The required behavior can be tested at CLI and integration seams with existing Vitest and command execution patterns."
      },
      {
        "name": "automation-readiness",
        "score": 5,
        "rationale": "The MVP requires stable JSON output/input contracts and uses templjs only for rendering from authoritative JSON."
      }
    ],
    "notes": "The PRD is intentionally small enough for immediate agent execution while preserving fail-closed invariants."
  },
  "implementationDecisions": [
    {
      "statement": "Expose `dv task ready --json` as the first Sandcastle selection contract.",
      "rationale": "Sandcastle needs a stable command boundary rather than library-only helpers or inline scripts.",
      "category": "api-contract"
    },
    {
      "statement": "Use SQLite-backed claims and claim-owned file locks for the dogfood MVP instead of waiting for immutable scope graphs.",
      "rationale": "The local runtime authority prevents duplicate local selection and conflicting file mutations while preserving a storage-adapter boundary for future hosted authority.",
      "category": "architecture"
    },
    {
      "statement": "Add `dv task show --json` as the authoritative task context model and render `dv task prompt` from the same JSON.",
      "rationale": "Machine-readable task context and Sandcastle prompt text must not diverge; templjs should render but not decide policy.",
      "category": "interface"
    },
    {
      "statement": "Use templjs for human and prompt rendering only.",
      "rationale": "Templates shorten implementation and improve consistency, but eligibility, claim state, validation, and linking decisions must remain in code.",
      "category": "technical-clarification"
    },
    {
      "statement": "Include `dv task record --claim --payload` in the minimum dogfood surface.",
      "rationale": "Claim-aware evidence creation and linking removes brittle Sandcastle glue and avoids hand-editing backlog state.",
      "category": "api-contract"
    },
    {
      "statement": "Make JSON payload input the primary MVP interface for task records, including stdin support.",